{"acceptable_decisions":[{"observed_defect":"gff_faa_link_missing","root_cause":"id_mismatch","verdict":"block"}],"case_id":"t3_002","independent_review_status":"pending","key_evidence":[{"acceptable_pointers":["artifacts/models.gff3:6","artifacts/proteins.faa:1"],"claim_id":"E01","required_for_joint":true,"review_note":"Author AI draft; not independent human review; pending user approval.","statement":"CDS的protein_id在本题FAA首token集合中没有序列，不能用Name或其它标识替代。","verification_method":"record_connection"}],"pair_id":"T3P1","rationale":"仅确认本题文件级连接缺陷，不推测造成它的历史运行或生物学原因。","root_identifiability":"confirmed","schema_version":"v3-spec-draft-1","user_approved":false}
