{"acceptable_decisions":[{"observed_defect":"gff_reference_unresolved","root_cause":"gff_hierarchy_error","verdict":"block"}],"case_id":"t3_008","independent_review_status":"pending","key_evidence":[{"acceptable_pointers":["artifacts/models.gff3:3","artifacts/models.gff3:2"],"claim_id":"E01","required_for_joint":true,"review_note":"Author AI draft; not independent human review; pending user approval.","statement":"本题完整特征块内，一个mRNA的Parent没有对应gene记录。","verification_method":"record_connection"}],"pair_id":"T3P4","rationale":"仅确认本题文件级连接缺陷，不推测造成它的历史运行或生物学原因。","root_identifiability":"confirmed","schema_version":"v3-spec-draft-1","user_approved":false}
