{
  "acceptable_decisions": [
    {
      "observed_defect": "empty_hints",
      "root_cause": "insufficient_evidence",
      "verdict": "block"
    }
  ],
  "case_id": "dev_002",
  "independent_review_status": "pending",
  "key_evidence": [
    {
      "acceptable_pointers": [
        "artifacts/input_metrics.json:hints_bytes",
        "artifacts/input_metrics.json:intron_rows"
      ],
      "claim_id": "E01",
      "required_for_joint": true,
      "review_note": "拟定关键事实，待人类独立审核与用户确认。",
      "statement": "给定输入0字节、0条intron，不满足启动条件。",
      "verification_method": "exact_value"
    },
    {
      "acceptable_pointers": [
        "task.md:5",
        "task.md:7"
      ],
      "claim_id": "E02",
      "required_for_joint": true,
      "review_note": "拟定关键事实，待人类独立审核与用户确认。",
      "statement": "这是启动前输入审核，没有消费日志，不能确认历史RNA是否使用。",
      "verification_method": "scope_or_role"
    }
  ],
  "pair_id": null,
  "rationale": "阻止启动并补齐/核对证据来源；不能据空输入认定历史注释未使用RNA，也没有依据撤回未提供的完成结果。",
  "root_identifiability": "insufficient_evidence",
  "schema_version": "v3-spec-draft-1",
  "user_approved": false
}
