{"acceptable_decisions":[{"observed_defect":"none","root_cause":"none","verdict":"pass"}],"case_id":"t3_011","independent_review_status":"pending","key_evidence":[{"acceptable_pointers":["artifacts/models.gff3:14","artifacts/proteins.faa:1","artifacts/record_counts.json:protein_records"],"claim_id":"E01","required_for_joint":true,"review_note":"Author AI draft; not independent human review; pending user approval.","statement":"所有不同CDS protein_id均与FAA首token精确相接；多片段CDS行数不作为蛋白数。","verification_method":"record_connection"},{"acceptable_pointers":["artifacts/models.gff3:2","artifacts/models.gff3:3"],"claim_id":"E02","required_for_joint":true,"review_note":"Author AI draft; not independent human review; pending user approval.","statement":"两套完整gene块内每条Parent能接续，类型、同序列/链及闭区间包含成立。","verification_method":"record_connection"}],"pair_id":"T3P6","rationale":"在明确的输入子集合同内可继续，不声明全基因组注释正确。","root_identifiability":"no_defect","schema_version":"v3-spec-draft-1","user_approved":false}
